{"evidenceVersion":"m0.5-native-aot-evidence-v1","recordType":"cell","cell":{"runnerOs":"Ubuntu","rid":"linux-x64","processArchitecture":"X64"},"profile":{"targetFramework":"net10.0","configuration":"Release","publishAot":true,"selfContained":true,"publishTrimmed":true,"runtimeIdentifier":"linux-x64"},"commands":[["dotnet","restore","ContractScribe.slnx"],["dotnet","build","ContractScribe.slnx","--configuration","Release","--no-restore"],["pwsh","-NoProfile","-File","tests/ContractScribe.Roslyn.Experiment/verify-m0.4.ps1","-Configuration","Release","-M05ManifestPath","tests/fixtures/roslyn-msbuild/v1/m0.5-native-aot-manifest.json"],["dotnet","restore","tests/ContractScribe.Roslyn.NativeAot.Experiment/ContractScribe.Roslyn.NativeAot.Experiment.csproj","--runtime","linux-x64"],["dotnet","publish","tests/ContractScribe.Roslyn.NativeAot.Experiment/ContractScribe.Roslyn.NativeAot.Experiment.csproj","--configuration","Release","--runtime","linux-x64","--no-restore"],["native","tests/fixtures/roslyn-msbuild/v1/Sample.sln","cell-output"]],"warnings":[],"toolchain":{"sdkVersion":"10.0.302","runtimeVersion":"10.0.10","msbuildVersion":"18.6.11.33009","nativeCompilerId":"clang","nativeCompilerVersion":"18.1.3","linkerId":"lld","linkerVersion":"18.1.3","runnerOs":"Ubuntu","rid":"linux-x64","processArchitecture":"X64"},"dependencies":["m04-fixture","m04-manifest","global-json","native-toolchain"],"outcome":"not-feasible","phase":"publish","cause":"trimming-reflection","code":"publish.trimming-analysis-failed","comparison":{"status":"not-run","frameworkPayloadSha256":"e5d3bc87a0448da6e953956aae897b33738a16efbedfeeefe1366fc5b8afbd29"},"observations":[{"phase":"publish","cause":"trimming-reflection","code":"publish.trimming-analysis-failed"}]}